time,relay,order,received,sent
2026-04-20 09:53:11,relay_03_stablelm_zephyr,0,There's a beautiful day outside.,The weather is lovely outdoors.
2026-04-20 09:53:18,relay_05_stablelm,1,The weather is lovely outdoors.,The pleasant weather extends beyond the outdoors.
2026-04-20 09:53:22,relay_02_smol,2,The pleasant weather extends beyond the outdoors.,The pleasant weather is extending beyond the outdoors.
2026-04-20 09:53:27,relay_05_stablelm,3,The pleasant weather is extending beyond the outdoors.,Le bon temps guérit au-delà des jardins.
2026-04-20 09:53:33,relay_03_stablelm_zephyr,4,Le bon temps guérit au-delà des jardins.,Nice weather is happening beyond the gardens.
2026-04-20 09:53:41,relay_01_qwen,5,Nice weather is happening beyond the gardens.,Beautiful weather outside the gardens.
2026-04-20 09:53:54,relay_04_phi,6,Beautiful weather outside the gardens.,Someone commented on the pleasant weather in the gardens.
2026-04-20 09:54:01,relay_01_qwen,7,Someone commented on the pleasant weather in the gardens.,The comment praised the nice weather in the garden areas.
